[
  {
    "these": "Der Autoverkehr in der Innenstadt soll zugunsten von Rad- und Busverkehr eingeschränkt werden.",
    "kategorie": "Verkehr & Mobilität",
    "partei": "Linke",
    "wertung": 1,
    "sicherheit": "hoch",
    "zitat": "Schritte hin zum autofreien Bohlweg werden unternommen.",
    "seite": 13,
    "kommentar": "Zusätzlich werden Busvorrang an Ampeln, separate Busspuren und Radweg-Ausbau gefordert; Parkplätze sollen primär Anwohner*innen vorbehalten sein.",
    "modell": "Claude Sonnet 5",
    "eingelesen": "2026-08-13"
  },
  {
    "these": "In Braunschweig soll flächendeckend Tempo 30 gelten.",
    "kategorie": "Verkehr & Mobilität",
    "partei": "Linke",
    "wertung": 0,
    "sicherheit": "mittel",
    "zitat": "Tempo 30 in der Innenstadt wird ausgeweitet. Unsere Vision ist dieses Tempolimit überall innerhalb des wilhelminischen Rings.",
    "seite": 13,
    "kommentar": "Die Linke fordert Tempo 30 nur innerhalb des wilhelminischen Rings (Innenstadt), nicht ausdrücklich flächendeckend für ganz Braunschweig.",
    "modell": "Claude Sonnet 5",
    "eingelesen": "2026-08-13"
  },
  {
    "these": "Neue Radwege sollen Vorrang vor dem Erhalt von Parkplätzen haben.",
    "kategorie": "Verkehr & Mobilität",
    "partei": "Linke",
    "wertung": 1,
    "sicherheit": "mittel",
    "zitat": "Lücken im Radwegenetz werden geschlossen, Velorouten ohne Kompromisse gebaut.",
    "seite": 13,
    "kommentar": "Kein expliziter Vergleich mit Parkplätzen, aber 'ohne Kompromisse' sowie die Vision, dass Parkplätze nur noch Anwohner*innen vorbehalten bleiben, deuten auf Priorität für Radinfrastruktur.",
    "modell": "Claude Sonnet 5",
    "eingelesen": "2026-08-13"
  },
  {
    "these": "Der Nahverkehr soll perspektivisch für alle kostenlos werden.",
    "kategorie": "Verkehr & Mobilität",
    "partei": "Linke",
    "wertung": 1,
    "sicherheit": "hoch",
    "zitat": "Mittelfristig muss der ÖPNV für alle kostenfrei sein.",
    "seite": 13,
    "kommentar": "",
    "modell": "Claude Sonnet 5",
    "eingelesen": "2026-08-13"
  },
  {
    "these": "Wer ohne Fahrschein erwischt wird, soll nicht mehr angezeigt werden.",
    "kategorie": "Verkehr & Mobilität",
    "partei": "Linke",
    "wertung": 1,
    "sicherheit": "hoch",
    "zitat": "Die BSVG schließt sich Städten wie Köln und Potsdam an und stellt keine Strafanzeigen mehr wegen \"Erschleichens von Leistungen\".",
    "seite": 13,
    "kommentar": "",
    "modell": "Claude Sonnet 5",
    "eingelesen": "2026-08-13"
  },
  {
    "these": "Braunschweig soll spätestens 2030 klimaneutral sein.",
    "kategorie": "Klima & Umwelt",
    "partei": "Linke",
    "wertung": -1,
    "sicherheit": "mittel",
    "zitat": "Ein weiteres Ziel im Klimaschutzkonzept ist die Klimaneutralität bis \"möglichst\" 2030. Dieses Ziel ist nicht mehr zu erreichen.",
    "seite": 18,
    "kommentar": "Die Linke hält das städtische 2030-Ziel für nicht mehr erreichbar und formuliert stattdessen die Vision einer klimaneutralen Energieversorgung bis 2035.",
    "modell": "Claude Sonnet 5",
    "eingelesen": "2026-08-13"
  },
  {
    "these": "Klimaschutzmaßnahmen dürfen keine zusätzlichen Kosten oder Verbote für Bürger:innen und Unternehmen bedeuten.",
    "kategorie": "Klima & Umwelt",
    "partei": "Linke",
    "wertung": -1,
    "sicherheit": "mittel",
    "zitat": "Wir setzen uns weiter dafür ein, den Baumbestand zu schützen, unter anderem durch eine Baumschutzsatzung.",
    "seite": 47,
    "kommentar": "Keine explizite Aussage zur These, aber die Linke befürwortet regulatorische Maßnahmen wie eine Baumschutzsatzung; sie fordert lediglich, soziale Folgekosten (z.B. Mietsteigerungen durch Sanierungen) sozial abzufedern statt Klimaschutz ganz ohne Kosten/Verbote umzusetzen.",
    "modell": "Claude Sonnet 5",
    "eingelesen": "2026-08-13"
  },
  {
    "these": "Auf möglichst allen geeigneten städtischen Dächern und Parkplätzen sollen Solaranlagen entstehen.",
    "kategorie": "Klima & Umwelt",
    "partei": "Linke",
    "wertung": 1,
    "sicherheit": "hoch",
    "zitat": "Beim Ausbau der erneuerbaren Energien haben bereits versiegelte Flächen oder Flächen zur Mehrfach-Nutzung Vorrang - z.B. PV Parkplatzüberdachung, öffentliche Gebäude.",
    "seite": 19,
    "kommentar": "",
    "modell": "Claude Sonnet 5",
    "eingelesen": "2026-08-13"
  },
  {
    "these": "Der Ausbau von Windkraft in Stadt und Region soll beschleunigt werden.",
    "kategorie": "Klima & Umwelt",
    "partei": "Linke",
    "wertung": 0,
    "sicherheit": "niedrig",
    "zitat": "Die alten Windkraftanlagen in der Nähe von Geitelde werden in den nächsten Jahren modernisiert.",
    "seite": 19,
    "kommentar": "Nur Modernisierung bestehender Anlagen wird erwähnt, kein expliziter Ruf nach beschleunigtem Ausbau neuer Windkraft.",
    "modell": "Claude Sonnet 5",
    "eingelesen": "2026-08-13"
  },
  {
    "these": "Bei Neubauprojekten soll ein Sozialwohnungsanteil von mindestens 50 % vorgeschrieben werden.",
    "kategorie": "Wohnen & Bauen",
    "partei": "Linke",
    "wertung": 1,
    "sicherheit": "hoch",
    "zitat": "Um den Bestand an sozialem Wohnraum zu erhöhen, wird die Quote für sozial gebundene Wohnungen bei Neubauprojekten auf mindestens 50 % erhöht.",
    "seite": 5,
    "kommentar": "",
    "modell": "Claude Sonnet 5",
    "eingelesen": "2026-08-13"
  },
  {
    "these": "Große Wohnungskonzerne wie Vonovia und LEG sollen notfalls vergesellschaftet werden können.",
    "kategorie": "Wohnen & Bauen",
    "partei": "Linke",
    "wertung": 1,
    "sicherheit": "hoch",
    "zitat": "Die Wohnungsbestand der Konzerne LEG und Vonovia wird vergesellschaftet.",
    "seite": 5,
    "kommentar": "",
    "modell": "Claude Sonnet 5",
    "eingelesen": "2026-08-13"
  },
  {
    "these": "Die Stadt soll Bauland aktiv ankaufen, statt es an den Höchstbietenden zu verkaufen.",
    "kategorie": "Wohnen & Bauen",
    "partei": "Linke",
    "wertung": 1,
    "sicherheit": "hoch",
    "zitat": "Dafür wird die GGB finanziell besser ausgestattet und das Vorkaufsrecht zum Erwerb von vorrätigen Flächen genutzt. Bauland wird vorrangig über kommunales Erbbaurecht vergeben.",
    "seite": 5,
    "kommentar": "",
    "modell": "Claude Sonnet 5",
    "eingelesen": "2026-08-13"
  },
  {
    "these": "Neubau soll vorrangig auf bereits versiegelten Flächen stattfinden.",
    "kategorie": "Wohnen & Bauen",
    "partei": "Linke",
    "wertung": 0,
    "sicherheit": "niedrig",
    "zitat": "",
    "seite": null,
    "kommentar": "Keine explizite Aussage im Programm zu bevorzugten Bauflächen für Wohnungsneubau; nur für PV-Anlagen wird eine Priorität für bereits versiegelte Flächen genannt.",
    "modell": "Claude Sonnet 5",
    "eingelesen": "2026-08-13"
  },
  {
    "these": "Die Videoüberwachung im öffentlichen Raum soll ausgeweitet werden.",
    "kategorie": "Sicherheit & Ordnung",
    "partei": "Linke",
    "wertung": -1,
    "sicherheit": "hoch",
    "zitat": "Die öffentliche Videoüberwachung wird nicht als leeres Sicherheitsversprechen ausgeweitet.",
    "seite": 23,
    "kommentar": "",
    "modell": "Claude Sonnet 5",
    "eingelesen": "2026-08-13"
  },
  {
    "these": "Der Zentrale Ordnungsdienst soll mehr Personal und mehr Befugnisse (z.B. unmittelbarer Zwang) bekommen.",
    "kategorie": "Sicherheit & Ordnung",
    "partei": "Linke",
    "wertung": 0,
    "sicherheit": "niedrig",
    "zitat": "Mitarbeitende der Stadt, insbesondere des Zentralen Ordnungsdienstes, müssen daher verpflichtend antirassistisch geschult und aufgeklärt werden.",
    "seite": 31,
    "kommentar": "Keine Aussage zu mehr Personal oder Befugnissen; das Programm fordert stattdessen antirassistische Schulungen für den Ordnungsdienst.",
    "modell": "Claude Sonnet 5",
    "eingelesen": "2026-08-13"
  },
  {
    "these": "Bei Kriminalität soll konsequentes Durchgreifen Vorrang vor Präventionsangeboten haben.",
    "kategorie": "Sicherheit & Ordnung",
    "partei": "Linke",
    "wertung": -1,
    "sicherheit": "niedrig",
    "zitat": "Rassistische Handlungen sind oft keine Absicht, sondern entstammen Unwissenheit.",
    "seite": 31,
    "kommentar": "Keine direkte Aussage zur These; das Programm betont durchgängig soziale Ursachen, Aufklärung und Prävention statt eines harten Durchgreifens.",
    "modell": "Claude Sonnet 5",
    "eingelesen": "2026-08-13"
  },
  {
    "these": "In der Innenstadt sollen weitere Waffenverbotszonen eingerichtet werden.",
    "kategorie": "Sicherheit & Ordnung",
    "partei": "Linke",
    "wertung": -1,
    "sicherheit": "hoch",
    "zitat": "Instrumente wie Waffenverbotszonen sind Einfallstore für rassistisches Profiling.",
    "seite": 30,
    "kommentar": "",
    "modell": "Claude Sonnet 5",
    "eingelesen": "2026-08-13"
  },
  {
    "these": "Das Städtische Klinikum darf nicht privatisiert werden.",
    "kategorie": "Gesundheit & Soziales",
    "partei": "Linke",
    "wertung": 1,
    "sicherheit": "hoch",
    "zitat": "Das Städtische Klinikum bleibt in kommunaler Hand!",
    "seite": 43,
    "kommentar": "",
    "modell": "Claude Sonnet 5",
    "eingelesen": "2026-08-13"
  },
  {
    "these": "Das Städtische Klinikum soll trotz roter Zahlen nicht durch Sparmaßnahmen bei Personal oder Leistungen saniert werden.",
    "kategorie": "Gesundheit & Soziales",
    "partei": "Linke",
    "wertung": 1,
    "sicherheit": "hoch",
    "zitat": "Keine Sparmaßnahmen zulasten der Patient*innen und Beschäftigten des Klinikums.",
    "seite": 43,
    "kommentar": "",
    "modell": "Claude Sonnet 5",
    "eingelesen": "2026-08-13"
  },
  {
    "these": "Die Zahl der Frauenhausplätze und Beratungsstellen soll ausgebaut werden.",
    "kategorie": "Gesundheit & Soziales",
    "partei": "Linke",
    "wertung": 1,
    "sicherheit": "hoch",
    "zitat": "Angemessene finanzielle Ausstattung des Frauenhauses. Die Kapazitäten müssen dem Bedarf gemäß, mindestens entsprechend der Istanbul-Konvention, ausgebaut werden.",
    "seite": 37,
    "kommentar": "",